{
  "contractVersion": "1.0",
  "requestId": "d49d158e-191c-4e79-9d38-95310c2384db",
  "region": {
    "id": "calgary",
    "label": "Calgary, AB"
  },
  "hazard": "wildfire",
  "assessment": {
    "score": 6,
    "level": "low",
    "summary": "No active wildfires reported within 150 km of Calgary, AB. 0 fire-weather alert(s) in effect.",
    "factors": [
      {
        "key": "fire_proximity",
        "label": "Most threatening fire: distance to its approximate edge",
        "value": 150,
        "unit": "km",
        "contribution": 0.0,
        "explanation": "No active fires within 150 km."
      },
      {
        "key": "imminent_threat",
        "label": "Uncontained fire edge within 5 km",
        "value": 5,
        "unit": "km",
        "contribution": 0.0,
        "explanation": "No uncontained fire within 5 km."
      },
      {
        "key": "out_of_control_fires",
        "label": "Uncontained fires within 150 km",
        "value": 0,
        "unit": "fires",
        "contribution": 0.0,
        "explanation": "0 out of control, 0 being held (5 and 2.5 points each, max 10)."
      },
      {
        "key": "active_burned_area",
        "label": "Area of uncontained fires within 150 km",
        "value": 0,
        "unit": "ha",
        "contribution": 0.0,
        "explanation": "Reported size of out-of-control and being-held fires; 100,000 ha scores the maximum."
      },
      {
        "key": "fire_weather_alerts",
        "label": "Active heat, smoke, air quality or wind alerts",
        "value": 0,
        "unit": "alerts",
        "contribution": 0,
        "explanation": "None in effect."
      },
      {
        "key": "fire_history",
        "label": "Past fires over 1,000 ha within 150 km, last 10 years",
        "value": 18,
        "unit": "fires",
        "contribution": 6.4,
        "explanation": "From CWFIS reported fires; log scale, about 6 points for 15 fires, 10 points at 99 or more."
      }
    ]
  },
  "sources": [
    {
      "name": "CWFIS Active wildfires (NRCan)",
      "url": "https://geoserver.cwfif.nrcan.gc.ca/geoserver/wfs?service=WFS&version=2.0.0&request=GetFeature&typeName=public%3Acwfif_national_activefires&outputFormat=application%2Fjson&srsName=EPSG%3A4326&count=10000&sortBy=agency_code+A%2Crecord_start+D&CQL_FILTER=now%28%29%3E%3Drecord_start+AND+now%28%29%3C%3Drecord_end",
      "observedAt": "2026-10-29T14:00:21Z",
      "retrievedAt": "2026-10-29T14:00:21Z"
    },
    {
      "name": "CWFIS Reported fires, history (NRCan)",
      "url": "https://geoserver.cwfif.nrcan.gc.ca/geoserver/wfs?service=WFS&version=2.0.0&request=GetFeature&typeName=public%3Acwfif_national_reportedfires&outputFormat=application%2Fjson&srsName=EPSG%3A4326&count=10000&sortBy=record_start+D&CQL_FILTER=fire_year%3E%3D2016+AND+fire_year%3C2026+AND+fire_size%3E%3D1000+AND+BBOX%28geometry%2C-116.22128997209721%2C49.693348648648644%2C-111.92251002790279%2C52.39605135135135%2C%27EPSG%3A4326%27%29",
      "observedAt": "2026-10-29T14:00:21Z",
      "retrievedAt": "2026-10-29T14:00:21Z"
    },
    {
      "name": "ECCC Weather alerts",
      "url": "https://api.weather.gc.ca/collections/weather-alerts",
      "observedAt": "2026-10-29T14:00:21Z",
      "retrievedAt": "2026-10-29T14:00:21Z"
    }
  ],
  "dataMode": "live",
  "generatedAt": "2026-10-29T14:00:21Z",
  "expiresAt": "2026-10-29T15:00:21Z",
  "disclaimer": "Automated screening from agency-reported CWFIS data and ECCC alerts; fire extents are approximate circles from reported size. Not an official fire behaviour forecast."
}